{
  "_meta": {
    "feast": "Meeting of Our Lord",
    "tone": 3,
    "_author": "Cosmas of Maiuma"
  },
  "tone": 3,
  "ode1": {
    "irmos": "The Sun once passed over dry land in the midst of the deep.\nFor the water on both sides became firm as a wall\nwhile the people traversed the sea on foot,\nchanting in a manner pleasing to God:\nLet us sing unto the Lord;\nfor gloriously hath he been glorified.",
    "troparia": [
      {
        "refrain": "Glory to Thee, our God, glory to Thee!",
        "text": "Let the clouds pour forth rain,\nfor Christ the Sun Who is borne aloft upon a light cloud\nis brought to the temple as a babe in the arms of the unblemished one.\nWherefore, O ye faithful, let us cry aloud:\nLet us sing unto the Lord, for gloriously hath He been glorified!"
      },
      {
        "refrain": "Glory to Thee, our God, glory to Thee!",
        "text": "Be strong, ye hands of Symeon feeble with age;\nand ye weary legs of the elder,\nhasten straightway to meet Christ,\njoining chorus with the incorporeal ones, chanting:\nLet us sing unto the Lord, for gloriously hath He been glorified!"
      },
      {
        "refrain": "Glory to the Father, and to the Son, and to the Holy Spirit, now and ever, and unto ages of ages. Amen.",
        "text": "O ye heavens stretched out in wisdom, be glad; and rejoice, O thou earth!\nFor Christ the Fashioner,\nhaving come forth from the most blessed womb of His Mother,\nis borne by the Virgin Mother as a babe to God the Father,\nHe Who was before all the ages, for gloriously hath He been glorified!"
      }
    ],
    "katavasia": "The Sun once passed over dry land…"
  },
  "ode3": {
    "irmos": "O Lord, the firm foundation of those who put their trust in Thee,\ndo Thou establish the Church,\nwhich Thou hast purchased with thy precious blood.",
    "troparia": [
      {
        "refrain": "Glory to Thee, our God, glory to Thee!",
        "text": "He that was first begotten of the Father before the ages\nhath appeared as the firstborn Babe of the undefiled Virgin,\nstretching forth His hand unto Adam."
      },
      {
        "refrain": "Glory to Thee, our God, glory to Thee!",
        "text": "God the Word hath appeared as a babe,\nsetting aright the first-formed man,\nwho through deception had become childish of mind."
      },
      {
        "refrain": "Glory to the Father, and to the Son, and to the Holy Spirit, now and ever, and unto ages of ages. Amen.",
        "text": "Without undergoing change, the Creator became a Babe,\nrendering divine our nature,\nthe product of earth to which it returneth again."
      }
    ],
    "katavasia": "O Lord, the firm foundation…"
  },
  "ode4": {
    "irmos": "Thy virtue hath covered the heavens, O Christ,\nfor having come forth from the Ark of Thy sanctification,\nfrom Thine undefiled Mother,\nThou hast appeared in the temple of Thy glory\nas an infant borne in arms,\nfilling all with Thy praise.",
    "troparia": [
      {
        "refrain": "Glory to Thee, our God, glory to Thee!",
        "text": "Rejoicing, the Theotokos cried aloud:\nO Symeon, initiate of ineffable mysteries,\ntake in thine arms Christ, the Word Who hath become a babe,\nof Whom thou wast informed of old by the Holy Spirit,\nand cry out to Him: All things are filled with Thy praise!"
      },
      {
        "refrain": "Glory to Thee, our God, glory to Thee!",
        "text": "O Symeon, rejoicing take up Christ, the little Child,\non Whom thou hast set thy hope,\nthe Consolation of the Israel of God,\nthe Creator and Master of the law, Who fulfilleth the tenets of the law;\nand cry aloud to Him: All things are filled with Thy praise!"
      },
      {
        "refrain": "Glory to the Father, and to the Son, and to the Holy Spirit, now and ever, and unto ages of ages. Amen.",
        "text": "Beholding the beginningless Word borne as a babe in the flesh by the Virgin\nas on the throne of the cherubim,\nthe Author of all, Symeon marveled and cried aloud to Him:\nAll things are filled with Thy praise!"
      }
    ],
    "katavasia": "Thy virtue hath covered the heavens…"
  },
  "ode5": {
    "irmos": "In a vision Isaiah saw upon a throne,\nGod lifted up on high borne aloft by angels of glory;\nand he cried: 'Woe is me!\nFor I have foreseen God made flesh,\nthe Lord of the never-setting light\nand the King of peace.'",
    "troparia": [
      {
        "refrain": "Glory to Thee, our God, glory to Thee!",
        "text": "The divine elder, comprehending the glory that was revealed of old to the prophet,\nand beholding the Word held in His Mother's arms, cried aloud:\nRejoice, O pure one,\nfor like a throne, God the unwaning Light, Who reigneth with peace, is held by thee!"
      },
      {
        "refrain": "Glory to Thee, our God, glory to Thee!",
        "text": "The elder, bowing low and divinely touching the feet of the Mother of God who kneweth not wedlock, said:\nO pure one, thou dost bear Fire!\nI fear to hold the infant God, the unwaning Light, Who reigneth with peace!"
      },
      {
        "refrain": "Glory to the Father, and to the Son, and to the Holy Spirit, now and ever, and unto ages of ages. Amen.",
        "text": "Isaiah, purified by the burning ember brought by the seraphim,\nand the elder illumined by the Mother of God, cried to her:\nthou hast given me Him Whom thou dost bear in thine arms as with tongs,\nthe Light unwaning, Who reigneth with peace."
      }
    ],
    "katavasia": "In a vision Isaiah saw upon a throne…"
  },
  "ode6": {
    "irmos": "The Elder, having seen with his eyes the salvation\nthat was to come unto the peoples from God,\ncried aloud unto Thee:\n'O Christ, Thou art my God.'",
    "troparia": [
      {
        "refrain": "Glory to Thee, our God, glory to Thee!",
        "text": "In Sion wast Thou set as a stone of stumbling and a rock of offense for the disobedient,\nand the inviolate salvation of the faithful."
      },
      {
        "refrain": "Glory to Thee, our God, glory to Thee!",
        "text": "Clearly bearing the lineaments of Him Who begot Thee before the ages,\nin Thy tender compassion Thou hast now been clothed in the weakness of the earth-born."
      },
      {
        "refrain": "Glory to the Father, and to the Son, and to the Holy Spirit, now and ever, and unto ages of ages. Amen.",
        "text": "Now lettest him that worshipped Thee as the Son of the Most High,\nthe Son of the Virgin, God become a Child, depart in peace."
      }
    ],
    "katavasia": "The Elder, having seen with his eyes…"
  },
  "ode7": {
    "irmos": "O Thou Who in the midst of the fire\nbedewed the children as they discoursed on things divine,\nand Who didst take up Thy dwelling in the pure Virgin:\nO Word of God, Thee do we reverently praise chanting:\nO God of our fathers, Blessed art Thou.",
    "troparia": [
      {
        "refrain": "Glory to Thee, our God, glory to Thee!",
        "text": "I go to announce glad tidings unto Adam and Eve who dwell in Hades,\ncried Symeon, joining chorus with the prophets, singing:\nBlessed is the God of our fathers!"
      },
      {
        "refrain": "Glory to Thee, our God, glory to Thee!",
        "text": "God, the Redeemer of the race of mortals shall go even unto Hades;\nHe shall grant forgiveness to all, sight to the blind,\nand even the mute shall chant: Blessed is the God of our fathers!"
      },
      {
        "refrain": "Glory to the Father, and to the Son, and to the Holy Spirit, now and ever, and unto ages of ages. Amen.",
        "text": "And Symeon foretold to the Virgin:\nA sword shall pierce thy heart, O incorrupt one,\nbeholding thy Son upon the Cross,\nto Whom we cry out: Blessed is the God of our fathers!"
      }
    ],
    "katavasia": "O Thou Who in the midst of the fire…"
  },
  "ode8": {
    "irmos": "United together in the unbearable fire,\nyet not harmed by the flame,\nthe children, champions of godliness, sang a divine hymn:\nO all ye works of the Lord,\nbless ye the Lord and supremely exalt Him throughout all ages.",
    "troparia": [
      {
        "refrain": "Glory to Thee, our God, glory to Thee!",
        "text": "O people of Israel, beholding your glory, Emmanuel,\nthe Babe born of the Virgin,\njoin ye now in chorus in the presence of the Ark of God, chanting:\nBless the Lord, all ye works of the Lord, and supremely exalt Him throughout all ages!"
      },
      {
        "refrain": "Glory to Thee, our God, glory to Thee!",
        "text": "Behold, cried Symeon, this One Who is both God and Babe shall be a sign of contradiction.\nO ye faithful, let us cry aloud:\nBless the Lord, all ye works of the Lord, and supremely exalt Him throughout all ages!"
      },
      {
        "refrain": "Let us bless the Father, the Son, and the Holy Spirit, the Lord, now and ever, and unto ages of ages. Amen.",
        "text": "God the Word, being Life itself and having become a Babe,\nshall be the downfall of the disobedient,\nbut the restoration of those who chant with faith:\nBless the Lord, all ye works of the Lord, and supremely exalt Him throughout all ages!"
      }
    ],
    "katavasia": "United together in the unbearable fire…"
  },
  "ode9": {
    "irmos": "In the shadow and the letter of the Law,\nlet us, the faithful, discern a figure:\nevery male child that openeth the womb\nshall be sanctified to God.\nTherefore we magnify the firstborn Word\nand Son of the beginningless Father,\nthe firstborn Child of a Mother who hath not known a man.",
    "troparia": [
      {
        "refrain": "\"It is not the elder who holdeth Me, but rather I hold him; for he asketh Me to dismiss him.\" (Twice)",
        "text": "The ancients were wont to offer a pair of new-born doves and two young birds,\nbut the godly elder and the chaste prophetess Anna serve in their stead,\nmagnifying the only-begotten Son of the Father,\nWho was born of the Virgin and is borne into the temple."
      },
      {